{
  "$schema": "../card.acorn.schema.json",
  "border": "acorn",
  "name": "Incumbent Pyromancer",
  "manaCost": "{2}{R}",
  "manaValue": 3,
  "colors": ["R"],
  "colorIdentity": ["R"],
  "type": "Creature — Goblin Wizard",
  "types": ["Creature"],
  "supertypes": [],
  "subtypes": ["Goblin", "Wizard"],
  "text": "{T}: Incumbent Pyromancer deals 1 damage to any target.\nWhenever you cast an instant or sorcery spell, untap Incumbent Pyromancer.",
  "power": "1",
  "toughness": "3",
  "keywords": [],
  "rarity": "rare",
  "flavorText": "Running on a platform of fire, more fire, and tax breaks for fire.",
  "art": "",
  "artist": "AI Generated",
  "set": "CHAOS",
  "chaos": 1,
  "number": "A108"
}
