{
  "$schema": "../card.acorn.schema.json",
  "border": "acorn",
  "name": "Clown Car of Imps",
  "manaCost": "{2}{R}",
  "manaValue": 3,
  "colors": ["R"],
  "colorIdentity": ["B", "R"],
  "type": "Artifact — Vehicle",
  "types": ["Artifact"],
  "supertypes": [],
  "subtypes": ["Vehicle"],
  "text": "When Clown Car of Imps enters the battlefield, roll a six-sided die and create that many 1/1 red Imp creature tokens. (How did they all fit in there? Nobody knows. Nobody asks.)\nCrew 2",
  "power": "4",
  "toughness": "4",
  "keywords": ["Crew"],
  "rarity": "uncommon",
  "chaos": 2,
  "flavorText": "Seats two. Holds eleven. Smells like greasepaint and bad decisions.",
  "art": "",
  "artist": "AI Generated",
  "set": "CHAOS",
  "number": "C212"
}
