{
  "$schema": "../card.acorn.schema.json",
  "border": "acorn",
  "name": "Senior Auditor of Outcomes",
  "manaCost": "{2}{U}",
  "manaValue": 3,
  "colors": ["U"],
  "colorIdentity": ["U"],
  "type": "Creature — Human Auditor",
  "types": ["Creature"],
  "supertypes": [],
  "subtypes": ["Human", "Auditor"],
  "text": "Whenever an opponent rolls one or more dice, you may reroll one of them. Whenever an opponent flips one or more coins, you may reflip one of them. You choose which result is entered into the official record.",
  "power": "2",
  "toughness": "3",
  "keywords": [],
  "rarity": "rare",
  "chaos": 2,
  "flavorText": "\"Luck is just an unaudited variable,\" she said, voiding the natural 20.",
  "art": "",
  "artist": "AI Generated",
  "set": "CHAOS",
  "number": "B209",
  "extras": { "parasitic": "rerolls/reflips opponents' dice and coins" }
}
