{
  "$schema": "../card.acorn.schema.json",
  "border": "acorn",
  "name": "The Prophecy Do Be Coming True",
  "manaCost": "{W}{B}, and a bad feeling",
  "manaValue": "soon",
  "colors": ["W", "B"],
  "colorIdentity": ["W", "B"],
  "type": "Acorn Creature — Omen That Walks",
  "types": ["Creature"],
  "supertypes": [],
  "subtypes": ["Omen"],
  "text": "the prophecy do be flying. the prophecy do be unblockable. the prophecy is become true and there is nothing for it.\nPredict the next thing that happens at the table. you are correct. you have always been correct. this is the problem.\nwhenever you is right (always), the world is end a little. put a doom counter where the doom is go.\nThe Prophecy Do Be Coming True's power is however many times someone has said \"no way\" tonight. its toughness is also that, but sadder.",
  "power": "no way",
  "toughness": "way",
  "keywords": ["Flying"],
  "rarity": "foretold",
  "chaos": 5,
  "flavorText": "told you. told you. told you. told you. told —",
  "art": "",
  "artist": "AI Generated",
  "set": "CHAOS",
  "number": "F502",
  "extras": { "brokenGrammar": true, "fourthWall": "counts how many times 'no way' is said" }
}
