{
  "$schema": "../card.acorn.schema.json",
  "border": "acorn",
  "name": "Temp Staffer, Day One",
  "manaCost": "{W}",
  "manaValue": 1,
  "colors": ["W"],
  "colorIdentity": ["W"],
  "type": "Creature — Human Clerk",
  "types": ["Creature"],
  "supertypes": [],
  "subtypes": ["Human", "Clerk"],
  "text": "When Temp Staffer, Day One dies, create a 1/1 white Clerk creature token. (They sent a replacement before the body was cold.)",
  "power": "2",
  "toughness": "1",
  "keywords": [],
  "rarity": "common",
  "chaos": 1,
  "flavorText": "\"Where's the bathroom?\" were her first and, tragically, last words on the job.",
  "art": "",
  "artist": "AI Generated",
  "set": "CHAOS",
  "number": "B114"
}
