{
  "$schema": "../card.acorn.schema.json",
  "border": "acorn",
  "name": "Loanshark Larry, Last Seen Underwater",
  "manaCost": "{2}{B}{B}",
  "manaValue": 4,
  "colors": ["B"],
  "colorIdentity": ["B"],
  "type": "Legendary Acorn Creature — Goblin Spirit",
  "types": ["Creature"],
  "supertypes": ["Legendary"],
  "subtypes": ["Goblin", "Spirit"],
  "text": "Larry can't be blocked except by creatures that owe him a Favor, and creatures can't owe Larry a Favor, so Larry can't be blocked. (He worked this out himself. He's very proud.)\nWhenever Larry deals combat damage to a player, that player owes you a Favor from beyond the grave (create a Favor token). Death did not settle Larry's accounts. Death made the deadlines worse.\nWhen Larry dies, return him to the battlefield at the beginning of your next upkeep. He still hasn't been paid. He is not leaving until he is.",
  "power": "3",
  "toughness": "1",
  "keywords": [],
  "rarity": "rare",
  "chaos": 4,
  "flavorText": "They put him in the reservoir. He swam back up with a clipboard.",
  "art": "",
  "artist": "AI Generated",
  "set": "CHAOS",
  "number": "H408",
  "extras": { "token": "Favor (IOU)", "selfAware": "unblockable by circular logic" }
}
