{
  "$schema": "../card.acorn.schema.json",
  "border": "acorn",
  "name": "Doomsday Canvasser",
  "manaCost": "{1}{W}",
  "manaValue": 2,
  "colors": ["W"],
  "colorIdentity": ["W"],
  "type": "Acorn Creature — Human Campaigner Cleric",
  "types": ["Creature"],
  "supertypes": [],
  "subtypes": ["Human", "Campaigner", "Cleric"],
  "text": "Lifelink\nWhenever Doomsday Canvasser attacks, you may put a doom counter on the Doomsday Clock. If you do, create a 1/1 white Cleric creature token tapped and attacking. The good word spreads door to door.",
  "power": "2",
  "toughness": "2",
  "keywords": ["Lifelink"],
  "rarity": "uncommon",
  "chaos": 2,
  "flavorText": "Quota: fifty doors a day. Conversions: zero. Morale: alarmingly high.",
  "art": "",
  "artist": "AI Generated",
  "set": "CHAOS",
  "number": "F209"
}
