{
  "$schema": "../card.acorn.schema.json",
  "border": "acorn",
  "name": "A Goblin You Can Trust",
  "manaCost": "{1}{B}",
  "manaValue": 2,
  "colors": ["B"],
  "colorIdentity": ["B"],
  "type": "Acorn Creature — Goblin Rogue",
  "types": ["Creature"],
  "supertypes": [],
  "subtypes": ["Goblin", "Rogue"],
  "text": "When A Goblin You Can Trust enters the battlefield, point at one opponent and say \"this one's a friend of mine.\" That player draws a card and you create a Favor token.\nWhen A Goblin You Can Trust dies, the player you pointed at sacrifices a creature. Turns out you couldn't, actually. Trust him, that is.",
  "power": "2",
  "toughness": "2",
  "keywords": [],
  "rarity": "uncommon",
  "chaos": 3,
  "flavorText": "\"Stand-up guy. Solid. Loyal as the day is long.\" The day was short. It was December.",
  "art": "",
  "artist": "AI Generated",
  "set": "CHAOS",
  "number": "H311",
  "extras": { "token": "Favor (IOU)", "physicalAction": "point and say it" }
}
