{
  "$schema": "../card.acorn.schema.json",
  "border": "acorn",
  "name": "Zealous Poll Watcher",
  "manaCost": "{2}{W}",
  "manaValue": 3,
  "colors": ["W"],
  "colorIdentity": ["W"],
  "type": "Acorn Creature — Human Zealot",
  "types": ["Creature"],
  "supertypes": [],
  "subtypes": ["Human", "Zealot"],
  "text": "Vigilance\nWhenever an opponent votes, recounts, or holds an election, put a doom counter on the Doomsday Clock and Zealous Poll Watcher gets +1/+0 until end of turn. The end-times faction monitors every precinct.",
  "power": "2",
  "toughness": "3",
  "keywords": ["Vigilance"],
  "rarity": "common",
  "chaos": 1,
  "flavorText": "\"I'm not here to vote. I'm here to watch you regret it.\"",
  "art": "",
  "artist": "AI Generated",
  "set": "CHAOS",
  "number": "F112",
  "extras": { "interaction": "reacts to votes/recounts/elections" }
}
