{
  "$schema": "../card.acorn.schema.json",
  "border": "acorn",
  "name": "The Mayor Was Warned",
  "manaCost": "{1}{W}{B}",
  "manaValue": 3,
  "colors": ["W", "B"],
  "colorIdentity": ["W", "B"],
  "type": "Acorn Sorcery",
  "types": ["Sorcery"],
  "supertypes": [],
  "subtypes": [],
  "text": "Destroy target legendary creature an opponent controls. We told the Mayor. We told everyone. Nobody listened.\nIf the destroyed creature was a Mayor or an Incumbent, put two doom counters on the Doomsday Clock and gain 4 life. Vindication is its own reward.",
  "power": "",
  "toughness": "",
  "keywords": [],
  "rarity": "uncommon",
  "chaos": 2,
  "flavorText": "Brother Eschaton sent forty memos. They were filed under \"crank mail.\"",
  "art": "",
  "artist": "AI Generated",
  "set": "CHAOS",
  "number": "F208",
  "extras": { "interaction": "removal aimed at rival commanders / the Mayor / incumbents" }
}
