{
  "$schema": "../card.acorn.schema.json",
  "border": "acorn",
  "name": "Collection Plate",
  "manaCost": "{1}",
  "manaValue": 1,
  "colors": [],
  "colorIdentity": ["W", "B"],
  "type": "Acorn Artifact",
  "types": ["Artifact"],
  "supertypes": [],
  "subtypes": [],
  "text": "{T}: Add {W} or {B}. Pass the plate.\n{2}, {T}, Sacrifice Collection Plate: You gain 3 life and remove a doom counter from the Doomsday Clock. The collection is complete; the rapture may begin.",
  "power": "",
  "toughness": "",
  "keywords": [],
  "rarity": "common",
  "chaos": 1,
  "flavorText": "It comes around twice. The second time is not optional.",
  "art": "",
  "artist": "AI Generated",
  "set": "CHAOS",
  "number": "F111"
}
