{
  "$schema": "../card.acorn.schema.json",
  "border": "acorn",
  "name": "Doorstep Evangelist",
  "manaCost": "{1}{W}",
  "manaValue": 2,
  "colors": ["W"],
  "colorIdentity": ["W"],
  "type": "Acorn Creature — Human Cleric Campaigner",
  "types": ["Creature"],
  "supertypes": [],
  "subtypes": ["Human", "Cleric", "Campaigner"],
  "text": "When Doorstep Evangelist enters the battlefield, target opponent reveals their hand and you knock politely on the table three times.\nWhenever a campaign, vote, or election happens at this table, you gain 1 life. The doomsayers canvass too.",
  "power": "2",
  "toughness": "2",
  "keywords": [],
  "rarity": "common",
  "chaos": 1,
  "flavorText": "Will not leave until you take a pamphlet. The pamphlet is also a ballot.",
  "art": "",
  "artist": "AI Generated",
  "set": "CHAOS",
  "number": "F106",
  "extras": { "interaction": "rewards the table's campaigns/votes/elections" }
}
