{
  "$schema": "../card.acorn.schema.json",
  "border": "acorn",
  "name": "Three-Card Monte Dealer",
  "manaCost": "{1}{B}{R}",
  "manaValue": 3,
  "colors": ["B", "R"],
  "colorIdentity": ["B", "R"],
  "type": "Creature — Human Rogue Croupier",
  "types": ["Creature"],
  "supertypes": [],
  "subtypes": ["Human", "Rogue", "Croupier"],
  "text": "When Three-Card Monte Dealer enters the battlefield, look at the top three cards of your library, shuffle them facedown, and 'let an opponent pick the lady.' Whichever they don't pick, you put into your hand; the rest go on top in any order.",
  "power": "2",
  "toughness": "3",
  "keywords": [],
  "rarity": "uncommon",
  "chaos": 2,
  "flavorText": "Keep your eye on the queen. The queen left the table an hour ago.",
  "art": "",
  "artist": "AI Generated",
  "set": "CHAOS",
  "number": "C206"
}
